{
  "$schema": "https://json-schema.org/draft/2020-12/schema",
  "$id": "ao.atlas.run-link.v0.1",
  "type": "object",
  "required": ["contract_version", "task_id", "status", "evidence", "digest"],
  "properties": {
    "contract_version": { "const": "ao.atlas.run-link.v0.1" },
    "task_id": { "type": "string" },
    "status": { "type": "string" },
    "evidence": { "type": "object" },
    "digest": { "type": "string" }
  }
}

