{
  "contract_version": "ao.atlas.run-link.v0.1",
  "task_id": "mission-recommendation-baseline-month4-25-schema-validation-task",
  "status": "completed",
  "evidence": {
    "candidate_record": "nodes/mission-recommendation-baseline-month4-25-schema-validation/candidate_record.json",
    "checkpoint_bundle": "nodes/mission-recommendation-baseline-month4-25-schema-validation/checkpoint_bundle.json",
    "command_readback": "nodes/mission-recommendation-baseline-month4-25-schema-validation/command_readback.json",
    "foundry_import": "nodes/mission-recommendation-baseline-month4-25-schema-validation/foundry_import.json",
    "implementation_evidence": "nodes/mission-recommendation-baseline-month4-25-schema-validation/implementation_evidence.json",
    "node_gate": "nodes/mission-recommendation-baseline-month4-25-schema-validation/node_gate.json",
    "promoter_no_promotion": "nodes/mission-recommendation-baseline-month4-25-schema-validation/promoter_no_promotion.json",
    "public_safety_readback_binding": "nodes/mission-recommendation-baseline-month4-25-schema-validation/public-safety-readback-binding.json",
    "rollback_record": "nodes/mission-recommendation-baseline-month4-25-schema-validation/rollback_record.json",
    "sentinel_public_safety": "nodes/mission-recommendation-baseline-month4-25-schema-validation/sentinel_public_safety.json",
    "tests": "nodes/mission-recommendation-baseline-month4-25-schema-validation/tests.json",
    "verification": "nodes/mission-recommendation-baseline-month4-25-schema-validation/verification.json"
  },
  "digest": "sha256:4d7dee1cff122faa653c0d1bf4e0df368483d4492bdc5fbda9405ee711d21c90"
}
