{
  "contract_version": "ao.atlas.run-link.v0.1",
  "task_id": "mission-recommendation-feature-depth-next-wave-39-task",
  "status": "completed",
  "evidence": {
    "candidate_record": "docs/evidence/ao-atlas-feature-depth-followup-durability-v04/nodes/mission-recommendation-feature-depth-next-wave-39/candidate_record.json",
    "checkpoint_bundle": "docs/evidence/ao-atlas-feature-depth-followup-durability-v04/nodes/mission-recommendation-feature-depth-next-wave-39/checkpoint_bundle.json",
    "command_readback": "docs/evidence/ao-atlas-feature-depth-followup-durability-v04/nodes/mission-recommendation-feature-depth-next-wave-39/command_readback.json",
    "foundry_continuation_handoff": "docs/evidence/ao-atlas-feature-depth-followup-durability-v04/nodes/mission-recommendation-feature-depth-next-wave-39/foundry-continuation-handoff.json",
    "foundry_continuation_prompt": "docs/evidence/ao-atlas-feature-depth-followup-durability-v04/nodes/mission-recommendation-feature-depth-next-wave-39/foundry-continuation-prompt.md",
    "foundry_import": "docs/evidence/ao-atlas-feature-depth-followup-durability-v04/nodes/mission-recommendation-feature-depth-next-wave-39/foundry-import.json",
    "implementation_evidence": "docs/evidence/ao-atlas-feature-depth-followup-durability-v04/nodes/mission-recommendation-feature-depth-next-wave-39/implementation_evidence.json",
    "node_gate": "docs/evidence/ao-atlas-feature-depth-followup-durability-v04/nodes/mission-recommendation-feature-depth-next-wave-39/node_gate.json",
    "promoter_no_promotion": "docs/evidence/ao-atlas-feature-depth-followup-durability-v04/nodes/mission-recommendation-feature-depth-next-wave-39/promoter_no_promotion.json",
    "public_safety_readback_binding": "docs/evidence/ao-atlas-feature-depth-followup-durability-v04/nodes/mission-recommendation-feature-depth-next-wave-39/sentinel_public_safety.json",
    "rollback_record": "docs/evidence/ao-atlas-feature-depth-followup-durability-v04/nodes/mission-recommendation-feature-depth-next-wave-39/rollback_record.json",
    "sentinel_public_safety": "docs/evidence/ao-atlas-feature-depth-followup-durability-v04/nodes/mission-recommendation-feature-depth-next-wave-39/sentinel_public_safety.json",
    "tests": "docs/evidence/ao-atlas-feature-depth-followup-durability-v04/nodes/mission-recommendation-feature-depth-next-wave-39/tests.json",
    "verification": "docs/evidence/ao-atlas-feature-depth-followup-durability-v04/nodes/mission-recommendation-feature-depth-next-wave-39/verification.json"
  },
  "digest": "sha256:424cd48bc02876be53611b9271e10aa27a99b91c3feb038040c748dfc4bf31b5"
}
