{
  "contract_version": "ao.atlas.run-link.v0.1",
  "task_id": "mission-recommendation-month5-beta-operations-38-task",
  "status": "completed",
  "evidence": {
    "candidate_record": "nodes/mission-recommendation-month5-beta-operations-38/candidate_record.json",
    "checkpoint_bundle": "nodes/mission-recommendation-month5-beta-operations-38/checkpoint_bundle.json",
    "command_readback": "nodes/mission-recommendation-month5-beta-operations-38/command_readback.json",
    "foundry_import": "nodes/mission-recommendation-month5-beta-operations-38/foundry-import.json",
    "implementation_evidence": "nodes/mission-recommendation-month5-beta-operations-38/implementation_evidence.json",
    "node_gate": "nodes/mission-recommendation-month5-beta-operations-38/node_gate.json",
    "promoter_no_promotion": "nodes/mission-recommendation-month5-beta-operations-38/promoter_no_promotion.json",
    "rollback_record": "nodes/mission-recommendation-month5-beta-operations-38/rollback_record.json",
    "sentinel_public_safety": "nodes/mission-recommendation-month5-beta-operations-38/sentinel_public_safety.json",
    "tests": "nodes/mission-recommendation-month5-beta-operations-38/tests.json",
    "verification": "nodes/mission-recommendation-month5-beta-operations-38/verification.json"
  },
  "digest": "sha256:13da8fce936be0add4094df6b14041b173209a65e8665eadca598883db7c4783"
}
