{
  "contract_version": "ao.atlas.run-link.v0.1",
  "task_id": "mission-recommendation-feature-depth-next-wave-15-task",
  "status": "completed",
  "evidence": {
    "candidate_record": "docs/evidence/ao-atlas-feature-depth-followup-wave-v01/nodes/mission-recommendation-feature-depth-next-wave-15/candidate_record.json",
    "checkpoint_bundle": "docs/evidence/ao-atlas-feature-depth-followup-wave-v01/nodes/mission-recommendation-feature-depth-next-wave-15/checkpoint_bundle.json",
    "command_readback": "docs/evidence/ao-atlas-feature-depth-followup-wave-v01/nodes/mission-recommendation-feature-depth-next-wave-15/command_readback.json",
    "foundry_import": "docs/evidence/ao-atlas-feature-depth-followup-wave-v01/nodes/mission-recommendation-feature-depth-next-wave-15/foundry-import.json",
    "implementation_evidence": "docs/evidence/ao-atlas-feature-depth-followup-wave-v01/nodes/mission-recommendation-feature-depth-next-wave-15/implementation_evidence.json",
    "local_main_sync_readback": "docs/evidence/ao-atlas-feature-depth-followup-wave-v01/nodes/mission-recommendation-feature-depth-next-wave-15/local-main-sync-readback.json",
    "node_gate": "docs/evidence/ao-atlas-feature-depth-followup-wave-v01/nodes/mission-recommendation-feature-depth-next-wave-15/node_gate.json",
    "promoter_no_promotion": "docs/evidence/ao-atlas-feature-depth-followup-wave-v01/nodes/mission-recommendation-feature-depth-next-wave-15/promoter_no_promotion.json",
    "rollback_record": "docs/evidence/ao-atlas-feature-depth-followup-wave-v01/nodes/mission-recommendation-feature-depth-next-wave-15/rollback_record.json",
    "sentinel_public_safety": "docs/evidence/ao-atlas-feature-depth-followup-wave-v01/nodes/mission-recommendation-feature-depth-next-wave-15/sentinel_public_safety.json",
    "tests": "docs/evidence/ao-atlas-feature-depth-followup-wave-v01/nodes/mission-recommendation-feature-depth-next-wave-15/tests.json",
    "verification": "docs/evidence/ao-atlas-feature-depth-followup-wave-v01/nodes/mission-recommendation-feature-depth-next-wave-15/verification.json"
  },
  "digest": "sha256:ffab960592cdc5605b8733f7b734359c8c68d120431cbb11427bbbde7f94ea9c"
}
