{
  "contract_version": "ao.atlas.run-link.v0.1",
  "task_id": "mission-recommendation-month3-golden-path-9-task",
  "status": "completed",
  "evidence": {
    "candidate_record": "docs/evidence/ao-stack-golden-path-month3-wave-v01/nodes/mission-recommendation-month3-golden-path-9/candidate_record.json",
    "checkpoint_bundle": "docs/evidence/ao-stack-golden-path-month3-wave-v01/nodes/mission-recommendation-month3-golden-path-9/checkpoint_bundle.json",
    "command_readback": "docs/evidence/ao-stack-golden-path-month3-wave-v01/nodes/mission-recommendation-month3-golden-path-9/command_readback.json",
    "contract_compatibility_inventory": "docs/evidence/ao-stack-golden-path-month3-wave-v01/nodes/mission-recommendation-month3-golden-path-9/contract-compatibility-inventory.json",
    "foundry_import": "docs/evidence/ao-stack-golden-path-month3-wave-v01/nodes/mission-recommendation-month3-golden-path-9/foundry_import.json",
    "implementation_evidence": "docs/evidence/ao-stack-golden-path-month3-wave-v01/nodes/mission-recommendation-month3-golden-path-9/implementation_evidence.json",
    "node_gate": "docs/evidence/ao-stack-golden-path-month3-wave-v01/nodes/mission-recommendation-month3-golden-path-9/node_gate.json",
    "promoter_no_promotion": "docs/evidence/ao-stack-golden-path-month3-wave-v01/nodes/mission-recommendation-month3-golden-path-9/promoter_no_promotion.json",
    "public_safety_readback_binding": "docs/evidence/ao-stack-golden-path-month3-wave-v01/nodes/mission-recommendation-month3-golden-path-9/public-safety-readback-binding.json",
    "rollback_record": "docs/evidence/ao-stack-golden-path-month3-wave-v01/nodes/mission-recommendation-month3-golden-path-9/rollback_record.json",
    "scoped_public_safety_scan": "docs/evidence/ao-stack-golden-path-month3-wave-v01/nodes/mission-recommendation-month3-golden-path-9/scoped-public-safety-scan.json",
    "sentinel_public_safety": "docs/evidence/ao-stack-golden-path-month3-wave-v01/nodes/mission-recommendation-month3-golden-path-9/sentinel_public_safety.json",
    "tests": "docs/evidence/ao-stack-golden-path-month3-wave-v01/nodes/mission-recommendation-month3-golden-path-9/tests.json",
    "verification": "docs/evidence/ao-stack-golden-path-month3-wave-v01/nodes/mission-recommendation-month3-golden-path-9/verification.json"
  },
  "digest": "sha256:5cc53e0cf7fcf487b236c5e1a3c781075e9e2aeb0a0a220e0472293be4e8cfbf"
}
