{
  "contract_version": "ao.atlas.run-link.v0.1",
  "task_id": "mission-recommendation-hardening-30-task",
  "status": "completed",
  "evidence": {
    "atlas_compaction_resume_prompt": "docs/evidence/ao-atlas-long-run-hardening-wave-v01/nodes/mission-recommendation-hardening-30/atlas-compaction-resume-prompt.md",
    "candidate_record": "docs/evidence/ao-atlas-long-run-hardening-wave-v01/nodes/mission-recommendation-hardening-30/candidate_record.json",
    "checkpoint_bundle": "docs/evidence/ao-atlas-long-run-hardening-wave-v01/nodes/mission-recommendation-hardening-30/checkpoint_bundle.json",
    "command_readback": "docs/evidence/ao-atlas-long-run-hardening-wave-v01/nodes/mission-recommendation-hardening-30/command_readback.json",
    "compaction_resume_prompt_fixture": "docs/evidence/ao-atlas-long-run-hardening-wave-v01/nodes/mission-recommendation-hardening-30/compaction-resume-prompt-fixture.json",
    "foundry_import": "docs/evidence/ao-atlas-long-run-hardening-wave-v01/nodes/mission-recommendation-hardening-30/foundry-import.json",
    "implementation_evidence": "docs/evidence/ao-atlas-long-run-hardening-wave-v01/nodes/mission-recommendation-hardening-30/implementation_evidence.json",
    "node_gate": "docs/evidence/ao-atlas-long-run-hardening-wave-v01/nodes/mission-recommendation-hardening-30/node_gate.json",
    "promoter_no_promotion": "docs/evidence/ao-atlas-long-run-hardening-wave-v01/nodes/mission-recommendation-hardening-30/promoter_no_promotion.json",
    "rollback_record": "docs/evidence/ao-atlas-long-run-hardening-wave-v01/nodes/mission-recommendation-hardening-30/rollback_record.json",
    "sentinel_public_safety": "docs/evidence/ao-atlas-long-run-hardening-wave-v01/nodes/mission-recommendation-hardening-30/sentinel_public_safety.json",
    "tests": "docs/evidence/ao-atlas-long-run-hardening-wave-v01/nodes/mission-recommendation-hardening-30/tests.json",
    "verification": "docs/evidence/ao-atlas-long-run-hardening-wave-v01/nodes/mission-recommendation-hardening-30/verification.json"
  },
  "digest": "sha256:cd58740dcb10cd38e1f290a06c5c07967d9f6a7902e31f76283f55686fce6d7c"
}
