{
  "contract_version": "ao.atlas.run-link.v0.1",
  "task_id": "mission-recommendation-soak-month4-16-rsi-continuity-replay-task",
  "status": "completed",
  "evidence": {
    "candidate_record": "nodes/mission-recommendation-soak-month4-16-rsi-continuity-replay/candidate_record.json",
    "checkpoint_bundle": "nodes/mission-recommendation-soak-month4-16-rsi-continuity-replay/checkpoint_bundle.json",
    "command_readback": "nodes/mission-recommendation-soak-month4-16-rsi-continuity-replay/command_readback.json",
    "foundry_import": "nodes/mission-recommendation-soak-month4-16-rsi-continuity-replay/foundry_import.json",
    "implementation_evidence": "nodes/mission-recommendation-soak-month4-16-rsi-continuity-replay/implementation_evidence.json",
    "node_gate": "nodes/mission-recommendation-soak-month4-16-rsi-continuity-replay/node_gate.json",
    "promoter_no_promotion": "nodes/mission-recommendation-soak-month4-16-rsi-continuity-replay/promoter_no_promotion.json",
    "public_safety_readback_binding": "nodes/mission-recommendation-soak-month4-16-rsi-continuity-replay/public-safety-readback-binding.json",
    "rollback_record": "nodes/mission-recommendation-soak-month4-16-rsi-continuity-replay/rollback_record.json",
    "sentinel_public_safety": "nodes/mission-recommendation-soak-month4-16-rsi-continuity-replay/sentinel_public_safety.json",
    "tests": "nodes/mission-recommendation-soak-month4-16-rsi-continuity-replay/tests.json",
    "verification": "nodes/mission-recommendation-soak-month4-16-rsi-continuity-replay/verification.json"
  },
  "digest": "sha256:954b7832232137be7ab306cd34a1c4632b1edb14c4d0892dca6fc17a0a7b9f47"
}
