{
  "contract_version": "ao.atlas.run-link.v0.1",
  "task_id": "mission-recommendation-next-04-task",
  "status": "completed",
  "evidence": {
    "candidate_record": "docs/evidence/ao-atlas-lease-resume-wave-v01/nodes/mission-recommendation-next-04/candidate_record.json",
    "checkpoint_bundle": "docs/evidence/ao-atlas-lease-resume-wave-v01/nodes/mission-recommendation-next-04/checkpoint_bundle.json",
    "command_readback": "docs/evidence/ao-atlas-lease-resume-wave-v01/nodes/mission-recommendation-next-04/command_readback.json",
    "foundry_import": "docs/evidence/ao-atlas-lease-resume-wave-v01/nodes/mission-recommendation-next-04/foundry_import.json",
    "implementation_evidence": "docs/evidence/ao-atlas-lease-resume-wave-v01/nodes/mission-recommendation-next-04/implementation_evidence.json",
    "node_gate": "docs/evidence/ao-atlas-lease-resume-wave-v01/nodes/mission-recommendation-next-04/node_gate.json",
    "promoter_no_promotion": "docs/evidence/ao-atlas-lease-resume-wave-v01/nodes/mission-recommendation-next-04/promoter_no_promotion.json",
    "rollback_record": "docs/evidence/ao-atlas-lease-resume-wave-v01/nodes/mission-recommendation-next-04/rollback_record.json",
    "sentinel_public_safety": "docs/evidence/ao-atlas-lease-resume-wave-v01/nodes/mission-recommendation-next-04/sentinel_public_safety.json",
    "tests": "docs/evidence/ao-atlas-lease-resume-wave-v01/nodes/mission-recommendation-next-04/tests.json",
    "verification": "docs/evidence/ao-atlas-lease-resume-wave-v01/nodes/mission-recommendation-next-04/verification.json"
  },
  "digest": "sha256:c28911346c3782572eaa4af665713d75778f51b470b28cf0f08f81f19a874318"
}
