{
  "contract_version": "ao.atlas.run-link.v0.1",
  "task_id": "mission-recommendation-month3-final-closure-07-schema-owner-registry-task",
  "status": "completed",
  "evidence": {
    "candidate_record": "docs/evidence/ao-m3-final-closure-v01/nodes/mission-recommendation-month3-final-closure-07-schema-owner-registry/candidate_record.json",
    "checkpoint_bundle": "docs/evidence/ao-m3-final-closure-v01/nodes/mission-recommendation-month3-final-closure-07-schema-owner-registry/checkpoint_bundle.json",
    "command_readback": "docs/evidence/ao-m3-final-closure-v01/nodes/mission-recommendation-month3-final-closure-07-schema-owner-registry/command_readback.json",
    "foundry_import": "docs/evidence/ao-m3-final-closure-v01/nodes/mission-recommendation-month3-final-closure-07-schema-owner-registry/foundry-import/foundry-import.json",
    "implementation_evidence": "docs/evidence/ao-m3-final-closure-v01/nodes/mission-recommendation-month3-final-closure-07-schema-owner-registry/implementation_evidence.json",
    "month3_schema_owner_registry": "docs/evidence/ao-m3-final-closure-v01/nodes/mission-recommendation-month3-final-closure-07-schema-owner-registry/month3-schema-owner-registry-proposal.json",
    "node_gate": "docs/evidence/ao-m3-final-closure-v01/nodes/mission-recommendation-month3-final-closure-07-schema-owner-registry/node_gate.json",
    "promoter_no_promotion": "docs/evidence/ao-m3-final-closure-v01/nodes/mission-recommendation-month3-final-closure-07-schema-owner-registry/promoter_no_promotion.json",
    "rollback_record": "docs/evidence/ao-m3-final-closure-v01/nodes/mission-recommendation-month3-final-closure-07-schema-owner-registry/rollback_record.json",
    "sentinel_public_safety": "docs/evidence/ao-m3-final-closure-v01/nodes/mission-recommendation-month3-final-closure-07-schema-owner-registry/sentinel_public_safety.json",
    "tests": "docs/evidence/ao-m3-final-closure-v01/nodes/mission-recommendation-month3-final-closure-07-schema-owner-registry/tests.json",
    "verification": "docs/evidence/ao-m3-final-closure-v01/nodes/mission-recommendation-month3-final-closure-07-schema-owner-registry/verification.json"
  },
  "digest": "sha256:47260a4275013108211d4324b25e0fc1bb5409d408f7d923ee84548273a1b7b0"
}
