{
  "contract_version": "ao.atlas.run-link.v0.1",
  "task_id": "mission-recommendation-soak-month4-12-schema-validation-replay-task",
  "status": "completed",
  "evidence": {
    "candidate_record": "nodes/mission-recommendation-soak-month4-12-schema-validation-replay/candidate_record.json",
    "checkpoint_bundle": "nodes/mission-recommendation-soak-month4-12-schema-validation-replay/checkpoint_bundle.json",
    "command_readback": "nodes/mission-recommendation-soak-month4-12-schema-validation-replay/command_readback.json",
    "foundry_import": "nodes/mission-recommendation-soak-month4-12-schema-validation-replay/foundry_import.json",
    "implementation_evidence": "nodes/mission-recommendation-soak-month4-12-schema-validation-replay/implementation_evidence.json",
    "node_gate": "nodes/mission-recommendation-soak-month4-12-schema-validation-replay/node_gate.json",
    "promoter_no_promotion": "nodes/mission-recommendation-soak-month4-12-schema-validation-replay/promoter_no_promotion.json",
    "public_safety_readback_binding": "nodes/mission-recommendation-soak-month4-12-schema-validation-replay/public-safety-readback-binding.json",
    "rollback_record": "nodes/mission-recommendation-soak-month4-12-schema-validation-replay/rollback_record.json",
    "sentinel_public_safety": "nodes/mission-recommendation-soak-month4-12-schema-validation-replay/sentinel_public_safety.json",
    "tests": "nodes/mission-recommendation-soak-month4-12-schema-validation-replay/tests.json",
    "verification": "nodes/mission-recommendation-soak-month4-12-schema-validation-replay/verification.json"
  },
  "digest": "sha256:6accc04aeb474b69a811645522c06cd9a8c7bfbded4ef9822a8dd55f2e325906"
}
